{
  "$schema": "https://json-schema.org/draft/2020-12/schema",
  "$id": "https://transformer.local/contracts/model-catalog/v4/list-result.schema.json",
  "title": "transformer.model-catalog.v4.list result",
  "type": "object", "additionalProperties": false,
  "required": ["requestId", "models", "nextCursor", "cursorExpiresAt"],
  "properties": {"requestId": {"$ref": "common.schema.json#/$defs/uuid"}, "models": {"type": "array", "maxItems": 100, "items": {"$ref": "common.schema.json#/$defs/modelSummary"}}, "nextCursor": {"oneOf": [{"type": "null"}, {"$ref": "common.schema.json#/$defs/cursor"}]}, "cursorExpiresAt": {"oneOf": [{"type": "null"}, {"$ref": "common.schema.json#/$defs/timestamp"}]}}
}
