{
  "requestId": "aaaaaaaa-aaaa-4aaa-8aaa-aaaaaaaaaaaa",
  "models": [
    {
      "modelRef": "mdl_11111111111111111111111111111111",
      "label": "model-a",
      "generation": 2,
      "createdAt": "2026-09-16T12:00:00.000000Z",
      "dataContractSha256": "aaaaaaaaaaaaaaaaaaaaaaaaaaaaaaaaaaaaaaaaaaaaaaaaaaaaaaaaaaaaaaaa",
      "modelDefinitionSha256": "1a8aaa22ac170c1126ca425cf43a857c70c8091d8c69cc7c7023be96eff4e65d",
      "modelTuning": {
        "hiddenWidth": 16,
        "encoderLayerCount": 1,
        "attentionHeadCount": 4,
        "dropoutProbability": 0,
        "missingValuePolicy": "strict"
      },
      "targetIdentities": ["EventProbability"],
      "initialization": {"source": "random"},
      "producingRunId": "11111111-1111-4111-8111-111111111111"
    },
    {
      "modelRef": "mdl_22222222222222222222222222222222",
      "label": "model-a",
      "generation": 1,
      "createdAt": "2026-09-15T12:00:00.000000Z",
      "dataContractSha256": "bbbbbbbbbbbbbbbbbbbbbbbbbbbbbbbbbbbbbbbbbbbbbbbbbbbbbbbbbbbbbbbb",
      "modelDefinitionSha256": "1a8aaa22ac170c1126ca425cf43a857c70c8091d8c69cc7c7023be96eff4e65d",
      "modelTuning": {
        "hiddenWidth": 16,
        "encoderLayerCount": 1,
        "attentionHeadCount": 4,
        "dropoutProbability": 0,
        "missingValuePolicy": "strict"
      },
      "targetIdentities": ["EventProbability"],
      "initialization": {
        "source": "publishedModel",
        "parentModelRef": "mdl_11111111111111111111111111111111"
      },
      "producingRunId": "22222222-2222-4222-8222-222222222222"
    }
  ],
  "nextCursor": "mc5.AAAAAAAAAAAAAAAAAAAAAAAAAAAAAAAAAAAAAAAAAAA",
  "cursorExpiresAt": "2026-09-16T12:15:00.000000Z"
}
